<?xml version="1.0" encoding="UTF-8"?>
<!--
Copyright (C) 2015 Redjan Shabani

This program is free software; you can redistribute it and/or
modify it under the terms of the GNU General Public License
as published by the Free Software Foundation; either version 2
of the License, or (at your option) any later version.

This program is distributed in the hope that it will be useful,
but WITHOUT ANY WARRANTY; without even the implied warranty of
MERCHANTABILITY or FITNESS FOR A PARTICULAR PURPOSE.  See the
GNU General Public License for more details.

You should have received a copy of the GNU General Public License
along with this program; if not, write to the Free Software
Foundation, Inc., 59 Temple Place - Suite 330, Boston, MA  02111-1307, USA.
-->

<!ELEMENT dataset (calculator, subject*)>
<!ATTLIST dataset date CDATA #REQUIRED>

<!ELEMENT calculator EMPTY>
<!ATTLIST calculator
	seats CDATA #REQUIRED
	coalTh CDATA #REQUIRED
	partyTh CDATA #REQUIRED
	indivTh CDATA #REQUIRED
	method (HARE-NIEMEYER|DHONDT|SAINT-LAGUE) 'DHONDT'
>

<!ELEMENT subject EMPTY>
<!ATTLIST subject
	category (COALITION|PARTY|INDIVIDUAL) 'PARTY'
	name CDATA #REQUIRED
	votes CDATA #REQUIRED
>

